サークルID,サークル名,販売サイト,作品ID,作品名,販売価格,卸価格,販売数,売上額
RG01060496,BerryFeel,DLsite日本語版,RJ01516722,【オクスリえっち気持ちいいね】シゴデキ上司は後輩ちゃんを眠らせて鬼ピスして孕ませたい,1430,990,51,50490
RG01060496,BerryFeel,DLsite日本語版,RJ01606811,"【??做?感?真棒】勤?的上司想弄睡后?,然后?狂做????孕。",1430,990,9,8910
RG01060496,BerryFeel,DLsite日本語版,RJ01609025,"【??做?感覺真棒】勤奮的上司想弄睡後輩,然後瘋狂做愛讓?懷孕。",1430,990,7,6930
RG01060496,BerryFeel,DLsite日本語版,TOTAL,,,,67,66330
RG63532,CAPURI,DLsite日本語版,RJ373662,堕ちた元No1ホストが見下していた後輩ホストに手錠で縛られ開脚調教されたらプライド崩壊でメス堕ちした結果...,1215,793,3,2379
RG63532,CAPURI,DLsite日本語版,RJ373662,堕ちた元No1ホストが見下していた後輩ホストに手錠で縛られ開脚調教されたらプライド崩壊でメス堕ちした結果...,1430,990,1,990
RG63532,CAPURI,DLsite日本語版,RJ391739,誘発剤で強制発情させられたΩのマフィアが、裏切り者に屈辱の拘束監禁レイプでイカされた結果...,1215,793,5,3965
RG63532,CAPURI,DLsite日本語版,RJ391739,誘発剤で強制発情させられたΩのマフィアが、裏切り者に屈辱の拘束監禁レイプでイカされた結果...,1430,990,4,3960
RG63532,CAPURI,DLsite日本語版,RJ400624,はじめては、きみと。〜今日、幼馴染と××××します〜,1215,793,8,6344
RG63532,CAPURI,DLsite日本語版,RJ400624,はじめては、きみと。〜今日、幼馴染と××××します〜,1430,990,3,2970
RG63532,CAPURI,DLsite日本語版,RJ406899,"ガチムチ刑務所 ―囚人×看守のメス堕ちSEX獄中記―",1430,990,11,10890
RG63532,CAPURI,DLsite日本語版,RJ01008260,メスイキするまで催眠マッサージしてもいいですか?,1430,990,35,34650
RG63532,CAPURI,DLsite日本語版,RJ01024143,"肌肉男監獄 ―囚犯x警衛的墮落性愛監獄記?―",1215,793,4,3172
RG63532,CAPURI,DLsite日本語版,RJ01024538,?需要的是直?高潮的催眠按摩??,1215,793,2,1586
RG63532,CAPURI,DLsite日本語版,RJ01024547,?需要的是直達高潮的催眠按摩??,1215,793,2,1586
RG63532,CAPURI,DLsite日本語版,RJ01025726,"Can I give you a hypnotic massage until you get sissygasm?",1215,793,3,2379
RG63532,CAPURI,DLsite日本語版,RJ01025726,"Can I give you a hypnotic massage until you get sissygasm?",1430,990,1,990
RG63532,CAPURI,DLsite日本語版,RJ01037662,気高き騎士が激イキ触手責めから挿入懇願で快楽堕ちした結果...,1215,793,4,3172
RG63532,CAPURI,DLsite日本語版,RJ01037662,気高き騎士が激イキ触手責めから挿入懇願で快楽堕ちした結果...,1430,990,1,990
RG63532,CAPURI,DLsite日本語版,RJ01041332,"スーツの下を暴かせて 〜真面目な准教授のえっちな秘密〜",1430,990,2,1980
RG63532,CAPURI,DLsite日本語版,RJ01041332,"スーツの下を暴かせて 〜真面目な准教授のえっちな秘密〜",1215,793,3,2379
RG63532,CAPURI,DLsite日本語版,RJ01071018,ちくびコンプレックス青春物語!〜敏感すぎて、大好きな幼馴染に乳首だけでイかされました〜,1430,990,17,16830
RG63532,CAPURI,DLsite日本語版,RJ01084590,"Nipple complex! 〜Too sensitive, my best childhood friend made me cum just with my nipples!",1215,793,3,2379
RG63532,CAPURI,DLsite日本語版,RJ01084590,"Nipple complex! 〜Too sensitive, my best childhood friend made me cum just with my nipples!",1430,990,1,990
RG63532,CAPURI,DLsite日本語版,RJ01084619,"从乳?自卑?始的青春故事! ‾敏感的乳?太敏感了,我最?的青梅竹?只用乳?就?我高潮了!‾",1215,793,2,1586
RG63532,CAPURI,DLsite日本語版,RJ01084622,"從乳頭自卑開始的青春故事! ‾敏感的乳頭太敏感了,我最愛的青梅竹馬隻用乳頭就讓我高潮了!‾",1215,793,2,1586
RG63532,CAPURI,DLsite日本語版,RJ01095552,"Former No.1 host ended up being handcuffed and humiliated by a junior host whom he used to look down upon.",1430,990,1,990
RG63532,CAPURI,DLsite日本語版,RJ01100978,"ビッチな俺を指名したのは童貞でした 〜まさかの巨根で連続メスイキさせられるなんて!?〜",1215,793,12,9516
RG63532,CAPURI,DLsite日本語版,RJ01100978,"ビッチな俺を指名したのは童貞でした 〜まさかの巨根で連続メスイキさせられるなんて!?〜",1430,990,4,3960
RG63532,CAPURI,DLsite日本語版,RJ01108542,"ひとりエッチは先生と〜いじわる家庭教師×純情高校生 ナイショのオナニーレッスンで恥ずかしイキ!〜",1430,990,1,990
RG63532,CAPURI,DLsite日本語版,RJ01111838,第一次、想和?。〜今天、我和幼馴染××××〜,1215,793,2,1586
RG63532,CAPURI,DLsite日本語版,RJ01119309,"ガチムチ団地妻 ーイケメン配達員の甘い誘惑。私、夫以外の男と…ー",1430,990,31,30690
RG63532,CAPURI,DLsite日本語版,RJ01119354,"ガチムチ団地妻 ーサレ妻寝取られ前日譚。お願い、私を抱いて…ー",550,275,2,550
RG63532,CAPURI,DLsite日本語版,RJ01136944,"淫?的我被?男指名了 〜没想到居然会被巨根??高潮!?〜",1215,793,2,1586
RG63532,CAPURI,DLsite日本語版,RJ01136947,"淫盪的我被處男指名了 〜沒想到居然會被巨根連續高潮!?〜",1215,793,1,793
RG63532,CAPURI,DLsite日本語版,RJ01136947,"淫盪的我被處男指名了 〜沒想到居然會被巨根連續高潮!?〜",1430,990,1,990
RG63532,CAPURI,DLsite日本語版,RJ01153210,"アパートの部屋の壁に穴が空いていたら 〜覗き見から始まるエッチな関係〜",1215,793,15,11895
RG63532,CAPURI,DLsite日本語版,RJ01153210,"アパートの部屋の壁に穴が空いていたら 〜覗き見から始まるエッチな関係〜",1430,990,1,990
RG63532,CAPURI,DLsite日本語版,RJ01154181,"Stiff apartment house wife - Sweet seduction by a handsome delivery man. I've had sex with men other than my husband...",1430,990,3,2970
RG63532,CAPURI,DLsite日本語版,RJ01154208,"筋肉?地妻- 英俊送??的甜蜜?惑。 我和丈夫以外的男人...",1430,990,4,3960
RG63532,CAPURI,DLsite日本語版,RJ01154222,"筋肉團地妻- 英俊送貨員的甜蜜誘惑。 我和丈夫以外的男人..",1430,990,5,4950
RG63532,CAPURI,DLsite日本語版,RJ01154545,"被誘發藥劑強製發情的歐米茄𩩲道,被叛徒??監禁強暴至高潮的結果...",1430,990,1,990
RG63532,CAPURI,DLsite日本語版,RJ01160319,"今夜は君の血を吸いたい 〜イケメン吸血鬼に咬まれて吸われて...とろける催淫絶頂セックス〜",1430,990,3,2970
RG63532,CAPURI,DLsite日本語版,RJ01165885,"There is a hole in the wall of my apartment room - A erotic relationship that begins with a peek",1430,990,1,990
RG63532,CAPURI,DLsite日本語版,RJ01165915,公寓的房間墻上有一個洞〜從?窺開始的色色的關系,1215,793,1,793
RG63532,CAPURI,DLsite日本語版,RJ01167767,"A noble knight's pleasure fall from a hard-on by tentacle torment to a plea for penetration...",1215,793,1,793
RG63532,CAPURI,DLsite日本語版,RJ01173288,ビッチサキュバス♂陥落〜イケメンおにーさんのくそでかちんぽで連続絶頂!もうお腹いっぱい…〜,1215,793,14,11102
RG63532,CAPURI,DLsite日本語版,RJ01173288,ビッチサキュバス♂陥落〜イケメンおにーさんのくそでかちんぽで連続絶頂!もうお腹いっぱい…〜,1430,990,7,6930
RG63532,CAPURI,DLsite日本語版,RJ01179161,"今?我要吸?的血 - 被英俊的吸血鬼咬住並吸吮... 融化的催淫高潮性愛 -",1430,990,1,990
RG63532,CAPURI,DLsite日本語版,RJ01181222,"淫乱色魔被攻陷 ? 被?哥的大?巴持?高潮! 里面已?装不下了...",1215,793,2,1586
RG63532,CAPURI,DLsite日本語版,RJ01181222,"淫乱色魔被攻陷 ? 被?哥的大?巴持?高潮! 里面已?装不下了...",1430,990,1,990
RG63532,CAPURI,DLsite日本語版,RJ01181232,"淫亂色魔被攻陷 ? 被帥哥的大?巴持續高潮! 裡?已經裝不下了...",1215,793,1,793
RG63532,CAPURI,DLsite日本語版,RJ01181232,"淫亂色魔被攻陷 ? 被帥哥的大?巴持續高潮! 裡?已經裝不下了...",1430,990,2,1980
RG63532,CAPURI,DLsite日本語版,RJ01185017,家庭教師はどすけべエッチなメスお兄さん!〜生意気ショタが先生のエロ穴けつまんこでヘコヘコしちゃったなつやすみ〜,1430,990,2,1980
RG63532,CAPURI,DLsite日本語版,RJ01185017,家庭教師はどすけべエッチなメスお兄さん!〜生意気ショタが先生のエロ穴けつまんこでヘコヘコしちゃったなつやすみ〜,1215,793,19,15067
RG63532,CAPURI,DLsite日本語版,RJ01202124,"The private tutor is a naughty sexy male older brother! Cheeky boy gets all excited in the teacher's erotic hole and pussy",1430,990,1,990
RG63532,CAPURI,DLsite日本語版,RJ01202138,"家庭教??身淫?色情的雄性哥哥! 〜傲慢的正太在老?的色情洞穴里被?得???向的暑假〜",1215,793,2,1586
RG63532,CAPURI,DLsite日本語版,RJ01202144,"家庭教師變身淫盪色情的雄性哥哥! 〜傲慢的正太在老師的色情洞穴裡被?得暈頭轉向的暑假〜",1430,990,1,990
RG63532,CAPURI,DLsite日本語版,RJ01205052,潜入失敗!エリートスパイ〜媚薬拷問でメス堕ちしても組織の秘密は喋らない〜,1430,990,6,5940
RG63532,CAPURI,DLsite日本語版,RJ01222657,"バ先で出会った四十路おじさんがエロすぎた 〜年上の超絶テクでイカされまくって童貞喪失〜",1430,990,2,1980
RG63532,CAPURI,DLsite日本語版,RJ01222657,"バ先で出会った四十路おじさんがエロすぎた 〜年上の超絶テクでイカされまくって童貞喪失〜",1215,793,7,5551
RG63532,CAPURI,DLsite日本語版,RJ01232712,"Failed infiltration! Elite Spy - Aphrodisiac Torment of a Meth-enhanced But No Secrets of the Organization Will Be Told!",1215,793,1,793
RG63532,CAPURI,DLsite日本語版,RJ01233362,"潜入失?! 精英???被春?折磨和堕落,却不肯?出??的秘密......",1215,793,5,3965
RG63532,CAPURI,DLsite日本語版,RJ01233373,"潛入失敗! 精英間諜?被春藥折磨和墮落,卻不肯?出組織的秘密......",1215,793,5,3965
RG63532,CAPURI,DLsite日本語版,RJ01240418,"会長専属メス堕ちヤンキー 鬼畜生徒会長に無理やりケツ掘られるとか聞いてへん!",1215,793,3,2379
RG63532,CAPURI,DLsite日本語版,RJ01247144,"The Forty-Year-Old Man I Met at My Part-Time Job Was Too Sexy 〜Lost My Virginity by His Superior Techniques〜",1215,793,1,793
RG63532,CAPURI,DLsite日本語版,RJ01247735,"在打工的地方遇到的四十?大叔竟然太色了 〜被年?的超?技巧?到失禁并失去了童?〜",1215,793,1,793
RG63532,CAPURI,DLsite日本語版,RJ01247741,"在打工的地方遇到的四十?大叔竟然太色了 〜被年長的超強技巧?到失禁並失去了童貞〜",1430,990,1,990
RG63532,CAPURI,DLsite日本語版,RJ01247793,凌辱メス堕ち幽霊屋敷ー終わらない、淫霊たちの連続中出しセックスー,1430,990,7,6930
RG63532,CAPURI,DLsite日本語版,RJ01252863,"Humiliation Sluttification Ghost Mansion - Never-ending, Continuous Creampie Sex with Lustful Ghosts",1430,990,1,990
RG63532,CAPURI,DLsite日本語版,RJ01252914,?O雌性淪陷的鬼屋??無盡的淫靈連續?射性愛,1430,990,2,1980
RG63532,CAPURI,DLsite日本語版,RJ01266124,透明彼氏の痴漢ドッキリ〜オフィスで中出し羞恥エッチ〜,1215,793,5,3965
RG63532,CAPURI,DLsite日本語版,RJ01266124,透明彼氏の痴漢ドッキリ〜オフィスで中出し羞恥エッチ〜,1430,990,1,990
RG63532,CAPURI,DLsite日本語版,RJ01266681,会??属雌堕不良少年:我可没听??会被??学生会??行后入。,1215,793,1,793
RG63532,CAPURI,DLsite日本語版,RJ01276727,エッチな心の声がダダ漏れ中!?〜クールな幼馴染は俺のメスイキで頭いっぱい〜,1430,990,23,22770
RG63532,CAPURI,DLsite日本語版,RJ01296847,魔法少年の囚われ触手堕ち,1320,880,12,10560
RG63532,CAPURI,DLsite日本語版,RJ01300555,"Invisible Boyfriend's Groper Prank - Office Creampie Embarrassment",1215,793,2,1586
RG63532,CAPURI,DLsite日本語版,RJ01300600,透明男友的痴漢驚喜--羞恥中出的?公室性愛。,1215,793,1,793
RG63532,CAPURI,DLsite日本語版,RJ01313175,孕むまで犯していいですか?〜ヤンデレ保育士の手錠拘束プロポーズ〜,1430,990,27,26730
RG63532,CAPURI,DLsite日本語版,RJ01314987,"My naughty heart is leaking out of my mouth! 〜My best friend is full of my desire for sex!",1215,793,5,3965
RG63532,CAPURI,DLsite日本語版,RJ01315000,色色的心声毫无遮掩!?〜?气的青梅竹???子都想着和我做?〜,1215,793,4,3172
RG63532,CAPURI,DLsite日本語版,RJ01315013,色色的心聲毫無遮掩!?〜帥氣的青梅竹馬滿腦子都想著和我做愛〜,1215,793,1,793
RG63532,CAPURI,DLsite日本語版,RJ01315013,色色的心聲毫無遮掩!?〜帥氣的青梅竹馬滿腦子都想著和我做愛〜,1430,990,3,2970
RG63532,CAPURI,DLsite日本語版,RJ01331705,"壊されたいほど愛してる 〜共依存な僕らの緊縛狂愛セックス〜",1430,990,8,7920
RG63532,CAPURI,DLsite日本語版,RJ01347140,魔法少年的触手囚禁堕落,1402,971,3,2913
RG63532,CAPURI,DLsite日本語版,RJ01347140,魔法少年的触手囚禁堕落,1650,1100,1,1100
RG63532,CAPURI,DLsite日本語版,RJ01347885,王子のボクがオークなんかに堕とされるワケない!〜強制種付けで無理やりお嫁さんにされちゃった〜,1430,990,9,8910
RG63532,CAPURI,DLsite日本語版,RJ01353304,媚薬ロッカーに閉じ込められたので先生のケツマンコ犯しちゃいますね?,1430,990,10,9900
RG63532,CAPURI,DLsite日本語版,RJ01357094,"我能干到??孕??〜病?幼?的手???求婚〜",1430,990,5,4950
RG63532,CAPURI,DLsite日本語版,RJ01357098,"我能幹到?懷孕??〜病嬌幼師的手???求婚〜",1430,990,2,1980
RG63532,CAPURI,DLsite日本語版,RJ01366369,メスイキしないと出られない部屋で両片思い(?)男子が××しちゃう話,1980,1430,40,57200
RG63532,CAPURI,DLsite日本語版,RJ01381276,?到想要弄坏?〜相互依存的我?的??狂?性?〜,1430,990,1,990
RG63532,CAPURI,DLsite日本語版,RJ01381278,愛到想要弄壞?〜相互依存的我們的??狂熱性愛〜,1430,990,1,990
RG63532,CAPURI,DLsite日本語版,RJ01391277,敬虔なるシスターが快楽に堕ちる時〜救いよりも悪魔のちんぽをください…?〜,1980,1430,11,15730
RG63532,CAPURI,DLsite日本語版,RJ01397189,いじめっこヤンキーのメス堕ち記念日〜俺様がヒョロガリ陰キャの媚薬精液ちんぽなんかに負けるわけねぇ！〜,1683,1139,10,11390
RG63532,CAPURI,DLsite日本語版,RJ01416750,怪盗アナルセーヌ〜今宵、あなたのアナル処女を頂戴いたします〜,1430,990,22,21780
RG63532,CAPURI,DLsite日本語版,RJ01428335,鬼神さまに注がれて-生贄の愛されセックスは孕まされても終わらない-,1980,1430,49,70070
RG63532,CAPURI,DLsite日本語版,RJ01451356,"ぽぽぽ 八尺様に攫われた夜",1430,990,57,56430
RG63532,CAPURI,DLsite日本語版,RJ01472499,ガチムチ病棟〜先生のおちんぽ注射で私をお仕置きしてください〜,1980,1430,16,22880
RG63532,CAPURI,DLsite日本語版,RJ01483381,"鬼畜執事のドS射精管理?そのだらしないおちんぽ、躾けて差し上げます―",1980,1430,18,25740
RG63532,CAPURI,DLsite日本語版,RJ01489704,雄っぱい牧場でヒミツの搾乳れっすん！〜僕のミルク、たくさん味わってくださいね…?〜,1980,1430,4,5720
RG63532,CAPURI,DLsite日本語版,RJ01489704,雄っぱい牧場でヒミツの搾乳れっすん！〜僕のミルク、たくさん味わってくださいね…?〜,1584,1064,7,7448
RG63532,CAPURI,DLsite日本語版,RJ01503334,"身?王子的我怎?可能被?人??！〜因?制配?而被迫成?新娘〜",1215,793,1,793
RG63532,CAPURI,DLsite日本語版,RJ01504429,"身為王子的我怎麼可能被獸人??！〜因強制配種而被迫成為新娘〜",1215,793,1,793
RG63532,CAPURI,DLsite日本語版,RJ01506874,スプリットタンの先輩に喰べ尽くされる話,1980,1430,26,37180
RG63532,CAPURI,DLsite日本語版,RJ01507558,"被鬼神?注 - 作?祭品的?之性即便?孕也不会?束",1980,1430,1,1430
RG63532,CAPURI,DLsite日本語版,RJ01507560,"被鬼神傾注 - 作為祭品的愛之性即便懷孕也不會結束",1980,1430,11,15730
RG63532,CAPURI,DLsite日本語版,RJ01516755,大人のおもちゃでお仕置きドッキリ！〜イケメン俳優、生放送でハメられました〜,1980,1430,200,286000
RG63532,CAPURI,DLsite日本語版,RJ01524572,"欺凌者洋基的雌堕?念日〜我怎?可能会??一个?弱??的媚?精液?茎！〜",1683,1139,1,1139
RG63532,CAPURI,DLsite日本語版,RJ01525783,"欺凌者洋基的雌墮紀念日〜我怎麼可能會輸給一個?弱陰?的媚藥精液陰莖！〜",1980,1430,2,2860
RG63532,CAPURI,DLsite日本語版,RJ01554268,メスイキするまで催眠マッサージしてもいいですか?2〜矢上と南編〜,1430,990,88,87120
RG63532,CAPURI,DLsite日本語版,RJ01557147,淫習村〜触手神に嫁いだら孕むまで媚薬聖液を注がれて〜,1980,1430,175,250250
RG63532,CAPURI,DLsite日本語版,RJ01567559,"下衆ゴブリンと高飛車エルフ〜クソデカチンポに躾けられる森の性玩具〜",1430,990,31,30690
RG63532,CAPURI,DLsite日本語版,RJ01582697,先”生”指導室〜不良生徒にマゾバレして玩具でメス穴徹底指導されちゃいました〜,1215,793,147,116571
RG63532,CAPURI,DLsite日本語版,RJ01582697,先”生”指導室〜不良生徒にマゾバレして玩具でメス穴徹底指導されちゃいました〜,1430,990,74,73260
RG63532,CAPURI,DLsite日本語版,RJ01587118,ミルクだくだく?発情牛の搾乳マシン検査〜あなた専用のミルクタンクになりましゅ?〜,1584,1064,417,443688
RG63532,CAPURI,DLsite日本語版,RJ01587118,ミルクだくだく?発情牛の搾乳マシン検査〜あなた専用のミルクタンクになりましゅ?〜,1980,1430,30,42900
RG63532,CAPURI,DLsite日本語版,RJ01589168,"一個關於兩個互相暗戀的男孩,被困在一個不濕身就無法離開的房間裡,最終發生了關係的故事。",1980,1430,15,21450
RG63532,CAPURI,DLsite日本語版,RJ01590509,"怪盗阿??塞恩:今夜,我将取走?的肛??女",1430,990,9,8910
RG63532,CAPURI,DLsite日本語版,RJ01596359,"怪盜阿納爾塞恩:今夜,我將取走?的肛門處女",1430,990,14,13860
RG63532,CAPURI,DLsite日本語版,RJ01599527,硬?病?〜?用医生的肉棒注射来??我〜,1980,1430,10,14300
RG63532,CAPURI,DLsite日本語版,RJ01601959,ガチムチ按摩,1584,1064,108,114912
RG63532,CAPURI,DLsite日本語版,RJ01602947,硬漢病房〜請用醫生的肉棒注射來懲罰我〜,1980,1430,7,10010
RG63532,CAPURI,DLsite日本語版,TOTAL,,,,2031,2259712
